{
  "$schema": "https://json-schema.org/draft/2020-12/schema",
  "type": "object",
  "required": ["schema_version", "metadata", "questionnaire", "responses", "sources", "reconciliation", "validation"],
  "properties": {
    "schema_version": {"const": "1.0.0"},
    "metadata": {"type": "object"},
    "questionnaire": {"type": "object"},
    "responses": {"type": "array", "minItems": 1},
    "sources": {"type": "array", "minItems": 1},
    "reconciliation": {"type": "object"},
    "validation": {"type": "object"}
  }
}
